{
    "$schema": "https://sci-d-vis.com/schema/wtrl-json-0.1.0.schema.json",
    "$id": "urn:waterlint:wtrl-json:0.15.0:core:rfc-2119:bc43bc8c194b05c92f18a91f5f643789c646275656d34533c50bc80b13066295",
    "__WTRL_VERSION__": {
        "waterloo": "0.8.1",
        "schema": "0.1.0"
    },
    "__WTRL_META__": {
        "generated_at": "2026-06-08T21:41:56+02:00",
        "generator": "waterlint",
        "scope": "core",
        "flavour": "rfc-2119"
    },
    "__WTRL_ROLES__": {
        "attr": "Attribute name",
        "cmd": "Shell or CLI command",
        "dfn": "Definition of a term",
        "file": "File or path",
        "func": "Function or callable",
        "key": "Key on the keyboard",
        "label": "Section/Subsection label",
        "lit": "Literal text or code",
        "mod": "Module name",
        "op": "Operator symbol",
        "opt": "Command-line option or flag",
        "tag": "Tag or marker",
        "term": "Domain-specific term",
        "type": "Type name or annotation",
        "value": "Concrete value",
        "var": "Variable name",
        "var_type": "Variable and type, like 'var:type'"
    },
    "__WTRL_SCOPES__": {
        "public": {
            "value": 10,
            "description": ""
        },
        "extension": {
            "value": 20,
            "description": ""
        },
        "core": {
            "value": 30,
            "description": ""
        }
    },
    "__WTRL_TOC_MODULES__": {
        "mypkg.test_module_minimal": "/__WTRL_OBJECTS__/mypkg.test_module_minimal"
    },
    "__WTRL_TOC_CLASSES__": {},
    "__WTRL_TOC_CALLABLES__": {},
    "__WTRL_TOC_TYPES__": {},
    "__WTRL_TOC_VARIABLES__": {},
    "__WTRL_TOC_CONSTANTS__": {},
    "__WTRL_OBJECTS__": {
        "mypkg.test_module_minimal": {
            "path": "/server/devel/sdv/privat/uwe/source/sdv_doc_waterloo/package_main/doc/input-python/mypkg/test_module_minimal.py",
            "doc": {
                "Preamble": {
                    "profile": "module",
                    "normative_sections": [
                        "Contract"
                    ]
                },
                "Contract": {
                    "general": [
                        "MUST demonstrate the minimal module docstring."
                    ]
                }
            },
            "examples": [
                "/__WTRL_EXAMPLES__/sha256_a931e6008a5697cc206239bbde33c6d6fad20714774b2d32cadcba2e62dbc9c5"
            ]
        }
    },
    "__WTRL_EXAMPLES__": {
        "sha256_a931e6008a5697cc206239bbde33c6d6fad20714774b2d32cadcba2e62dbc9c5": {
            "lang": "python",
            "hash": "a931e6008a5697cc206239bbde33c6d6fad20714774b2d32cadcba2e62dbc9c5",
            "code": "import mypkg.test_module_minimal as m\n\nif __name__ == \"__main__\":\n\tprint(\"Module mypkg.test_module_minimal imported.\")\n",
            "referenced_by": [
                "mypkg.test_module_minimal"
            ]
        }
    }
}
